{
  "$schema": "https://labs.designfrom.com/schemas/meta.schema.json",
  "schemaVersion": 1,
  "name": "button",
  "kind": "component",
  "title": "Button",
  "description": "A button with five variants, four sizes and a loading state that keeps focus and announces progress, on Radix, Base UI or React Aria.",
  "status": "ready",
  "category": "actions",
  "label": "Labs examples",
  "variants": [
    {
      "name": "button-radix-lucide",
      "primitive": "radix",
      "iconSet": "lucide",
      "status": "ready"
    },
    {
      "name": "button-radix-phosphor",
      "primitive": "radix",
      "iconSet": "phosphor",
      "status": "ready"
    },
    {
      "name": "button-base-lucide",
      "primitive": "base",
      "iconSet": "lucide",
      "status": "ready"
    },
    {
      "name": "button-base-phosphor",
      "primitive": "base",
      "iconSet": "phosphor",
      "status": "ready"
    },
    {
      "name": "button-aria-lucide",
      "primitive": "aria",
      "iconSet": "lucide",
      "status": "ready"
    },
    {
      "name": "button-aria-phosphor",
      "primitive": "aria",
      "iconSet": "phosphor",
      "status": "ready"
    }
  ],
  "defaultVariant": "button-radix-lucide",
  "demo": {
    "*": "demo.tsx",
    "aria": "demo.aria.tsx"
  },
  "preview": "preview.webp",
  "source": {
    "repo": "https://github.com/Design-from-labs/labs",
    "commit": "803b92c1a30e0d513e1cb1ff5ca984b2a5f9b492",
    "path": "examples/button"
  },
  "author": "Design From Labs <https://labs.designfrom.com>",
  "license": "MIT",
  "credits": [
    "S-003",
    "S-004",
    "S-005",
    "S-006",
    "S-008",
    "S-018",
    "S-032",
    "S-033",
    "S-034"
  ],
  "date": "2026-10-12",
  "props": [
    {
      "name": "variant",
      "type": "\"default\" | \"secondary\" | \"outline\" | \"ghost\" | \"destructive\"",
      "default": "\"default\"",
      "description": "Visual weight. Use one default button per view."
    },
    {
      "name": "size",
      "type": "\"sm\" | \"md\" | \"lg\" | \"icon\"",
      "default": "\"md\"",
      "description": "Height and padding. An icon button needs an aria-label."
    },
    {
      "name": "loading",
      "type": "boolean",
      "default": "false",
      "description": "Shows a spinner and blocks activation while keeping focus: aria-disabled on Radix, focusableWhenDisabled on Base UI, isPending on React Aria."
    },
    {
      "name": "asChild",
      "type": "boolean",
      "default": "false",
      "description": "Radix only: render the child element (for example a link) with button styles."
    },
    {
      "name": "onPress",
      "type": "(e: PressEvent) => void",
      "description": "React Aria only: use onPress instead of onClick."
    },
    {
      "name": "...props",
      "type": "React.ComponentProps<\"button\">",
      "description": "Every native button attribute."
    }
  ],
  "a11y": [
    "A native button element: Enter and Space activate it, and it is in the tab order.",
    "Focus is always visible with a two-pixel ring in the ring token color.",
    "While loading, focus stays on the button: Radix uses aria-disabled with a click guard, Base UI keeps a disabled button focusable, React Aria uses isPending, which also announces the pending state.",
    "The spinner is aria-hidden and only spins when the user allows motion (motion-safe)."
  ],
  "usage": "<Button onClick={save} loading={saving}>Save changes</Button>"
}
