{
  "$schema": "https://labs.designfrom.com/schemas/meta.schema.json",
  "schemaVersion": 1,
  "name": "pop-out",
  "kind": "component",
  "title": "Pop Out",
  "description": "A block pushes up from below and pops the block on top of it into a small hop. Pure CSS keyframes, played once on mount.",
  "status": "beta",
  "category": "feedback",
  "label": "yui540/css-animations",
  "tags": [
    "animation",
    "css",
    "keyframes",
    "reduced-motion"
  ],
  "variants": [
    {
      "name": "pop-out",
      "primitive": "none",
      "iconSet": "none",
      "status": "beta"
    }
  ],
  "defaultVariant": "pop-out",
  "demo": "demo.tsx",
  "preview": "preview.webp",
  "source": {
    "repo": "https://github.com/yui540/css-animations",
    "commit": "e30edfcfcc3e0f7a3bd44f3d5566ee23c9aaa186",
    "path": "2026-04-18/tips-4.html"
  },
  "author": "yui540 <https://github.com/yui540>",
  "license": "MIT",
  "attribution": "Copyright (c) 2026 yui540. MIT License.",
  "credits": [
    "S-150",
    "S-003",
    "S-004",
    "S-008",
    "S-019",
    "S-020",
    "S-155",
    "S-156"
  ],
  "date": "2026-10-12",
  "props": [
    {
      "name": "key",
      "type": "React.Key",
      "description": "Change it to remount and play the animation again."
    },
    {
      "name": "...props",
      "type": "React.ComponentProps<\"div\">",
      "description": "Every native div attribute. className sizes the stage (default w-full max-w-80, square); aria-label names it."
    }
  ],
  "a11y": [
    "Decorative by default: the root is aria-hidden. Pass aria-label (or aria-labelledby) and it becomes role=\"img\" with that name.",
    "Right to left: the figure is mirrored, so it moves toward the reading direction.",
    "Reduced motion: no motion; both blocks show their resting state."
  ],
  "usage": "<PopOut key={run} aria-label=\"A block popping up out of another\" />"
}
