{
  "$schema": "https://labs.designfrom.com/schemas/meta.schema.json",
  "schemaVersion": 1,
  "name": "use-reduced-motion",
  "kind": "hook",
  "title": "useReducedMotion",
  "description": "A hook that reports whether the user prefers reduced motion and updates when the setting changes.",
  "status": "ready",
  "category": "foundations",
  "label": "Labs examples",
  "variants": [
    {
      "name": "use-reduced-motion",
      "primitive": "none",
      "iconSet": "none",
      "status": "ready"
    }
  ],
  "defaultVariant": "use-reduced-motion",
  "source": {
    "repo": "https://github.com/Design-from-labs/labs",
    "commit": "803b92c1a30e0d513e1cb1ff5ca984b2a5f9b492",
    "path": "examples/use-reduced-motion"
  },
  "author": "Design From Labs <https://labs.designfrom.com>",
  "license": "MIT",
  "credits": [
    "S-003",
    "S-004"
  ],
  "date": "2026-10-12",
  "props": [
    {
      "name": "returns",
      "type": "boolean",
      "description": "true when the user prefers reduced motion; false during server rendering."
    }
  ],
  "a11y": [
    "Use it to skip or shorten JavaScript-driven motion; CSS motion should use motion-safe and motion-reduce instead."
  ],
  "usage": "const reduceMotion = useReducedMotion();"
}
