{
  "$schema": "https://labs.designfrom.com/schemas/meta.schema.json",
  "schemaVersion": 1,
  "name": "font-figtree",
  "kind": "font",
  "title": "Figtree",
  "description": "The Figtree variable typeface as the sans-serif font (--font-sans).",
  "status": "ready",
  "category": "foundations",
  "label": "Labs examples",
  "variants": [
    {
      "name": "font-figtree",
      "primitive": "none",
      "iconSet": "none",
      "status": "ready"
    }
  ],
  "defaultVariant": "font-figtree",
  "demo": "demo.tsx",
  "preview": "preview.webp",
  "source": {
    "repo": "https://github.com/Design-from-labs/labs",
    "commit": "803b92c1a30e0d513e1cb1ff5ca984b2a5f9b492",
    "path": "examples/font-figtree"
  },
  "author": "Design From Labs <https://labs.designfrom.com>",
  "license": "MIT",
  "credits": [
    "S-035",
    "S-004",
    "S-025"
  ],
  "date": "2026-10-12",
  "usage": "npx shadcn@latest add https://labs.designfrom.com/r/font-figtree.json"
}
